{
  "id": "static-site-hosting",
  "title": "Static site & SPA hosting",
  "description": "Serve a static site or SPA from Object Storage behind Firewall and cached Applications.",
  "category": "Storage",
  "canvasWidth": 1120,
  "canvasHeight": 600,
  "theme": "dark",
  "grid": true,
  "numbered": false,
  "snap": true,
  "gridSize": 8,
  "notes": "Conceptual architecture. Upload the site build to a bucket with any S3-compatible client, set the bucket as the Applications origin, and route API paths to Functions with Rules Engine. Configure WAF rules and cache policies for your workload.",
  "updatedAt": "",
  "nodes": [
    {
      "id": "users",
      "label": "Users",
      "subtitle": "Web & mobile",
      "icon": "pi-users",
      "x": 48,
      "y": 244,
      "width": 152,
      "height": 96,
      "tone": "neutral",
      "shape": "card",
      "locked": false
    },
    {
      "id": "firewall",
      "label": "Firewall",
      "subtitle": "WAF rules",
      "icon": "ai-edge-firewall",
      "x": 288,
      "y": 244,
      "width": 152,
      "height": 96,
      "tone": "azion",
      "shape": "card",
      "locked": false
    },
    {
      "id": "app",
      "label": "Applications",
      "subtitle": "Cache & route",
      "icon": "ai-edge-application",
      "x": 528,
      "y": 244,
      "width": 152,
      "height": 96,
      "tone": "azion",
      "shape": "card",
      "locked": false
    },
    {
      "id": "storage",
      "label": "Object Storage",
      "subtitle": "Site build",
      "icon": "ai-edge-storage",
      "x": 856,
      "y": 140,
      "width": 152,
      "height": 96,
      "tone": "azion",
      "shape": "card",
      "locked": false
    },
    {
      "id": "fn",
      "label": "Functions",
      "subtitle": "API routes",
      "icon": "ai-edge-functions",
      "x": 856,
      "y": 348,
      "width": 152,
      "height": 96,
      "tone": "azion",
      "shape": "card",
      "locked": false
    }
  ],
  "edges": [
    {
      "id": "users-firewall",
      "from": "users",
      "to": "firewall",
      "label": "HTTPS",
      "dashed": false,
      "routing": "orthogonal",
      "arrow": "end",
      "locked": false
    },
    {
      "id": "firewall-app",
      "from": "firewall",
      "to": "app",
      "label": "Allowed",
      "dashed": false,
      "routing": "orthogonal",
      "arrow": "end",
      "locked": false
    },
    {
      "id": "app-storage",
      "from": "app",
      "to": "storage",
      "label": "Static assets",
      "dashed": false,
      "routing": "orthogonal",
      "arrow": "end",
      "locked": false
    },
    {
      "id": "app-fn",
      "from": "app",
      "to": "fn",
      "label": "Rules Engine",
      "dashed": false,
      "routing": "orthogonal",
      "arrow": "end",
      "locked": false
    }
  ],
  "groups": [
    {
      "id": "azion",
      "label": "AZION PLATFORM",
      "x": 248,
      "y": 104,
      "width": 816,
      "height": 388,
      "locked": false,
      "moveChildren": true,
      "tone": "neutral"
    }
  ]
}
