{
  "id": "multi-origin",
  "title": "Multi-origin architecture",
  "description": "Connect a single delivery layer to multiple origin environments.",
  "category": "Delivery",
  "canvasWidth": 1120,
  "canvasHeight": 600,
  "theme": "dark",
  "grid": true,
  "numbered": false,
  "snap": true,
  "gridSize": 8,
  "notes": "Logical origin-selection view. Configure origins, balancing policy, and health checks for the intended routing behavior.",
  "updatedAt": "",
  "nodes": [
    {
      "id": "users",
      "label": "Users",
      "subtitle": "Global audience",
      "icon": "pi-globe",
      "x": 48,
      "y": 244,
      "width": 152,
      "height": 96,
      "tone": "neutral",
      "shape": "card",
      "locked": false
    },
    {
      "id": "app",
      "label": "Applications",
      "subtitle": "Request routing",
      "icon": "ai-edge-application",
      "x": 288,
      "y": 244,
      "width": 152,
      "height": 96,
      "tone": "azion",
      "shape": "card",
      "locked": false
    },
    {
      "id": "lb",
      "label": "Load Balancer",
      "subtitle": "Origin selection",
      "icon": "ai-load-balancer",
      "x": 528,
      "y": 244,
      "width": 152,
      "height": 96,
      "tone": "azion",
      "shape": "card",
      "locked": false
    },
    {
      "id": "cloud",
      "label": "Cloud origin",
      "subtitle": "Primary origin",
      "icon": "pi-cloud",
      "x": 856,
      "y": 140,
      "width": 152,
      "height": 96,
      "tone": "neutral",
      "shape": "card",
      "locked": false
    },
    {
      "id": "dc",
      "label": "Data center",
      "subtitle": "Secondary origin",
      "icon": "pi-server",
      "x": 856,
      "y": 348,
      "width": 152,
      "height": 96,
      "tone": "neutral",
      "shape": "card",
      "locked": false
    }
  ],
  "edges": [
    {
      "id": "users-app",
      "from": "users",
      "to": "app",
      "label": "HTTPS",
      "dashed": false,
      "routing": "orthogonal",
      "arrow": "end",
      "locked": false
    },
    {
      "id": "app-lb",
      "from": "app",
      "to": "lb",
      "label": "Origin request",
      "dashed": false,
      "routing": "orthogonal",
      "arrow": "end",
      "locked": false
    },
    {
      "id": "lb-cloud",
      "from": "lb",
      "to": "cloud",
      "label": "Route",
      "dashed": false,
      "routing": "orthogonal",
      "arrow": "end",
      "locked": false
    },
    {
      "id": "lb-dc",
      "from": "lb",
      "to": "dc",
      "label": "Route",
      "dashed": false,
      "routing": "orthogonal",
      "arrow": "end",
      "locked": false
    }
  ],
  "groups": [
    {
      "id": "azion",
      "label": "AZION PLATFORM",
      "x": 248,
      "y": 104,
      "width": 472,
      "height": 388,
      "locked": false,
      "moveChildren": true,
      "tone": "neutral"
    },
    {
      "id": "origins",
      "label": "ORIGIN ENVIRONMENTS",
      "x": 816,
      "y": 104,
      "width": 248,
      "height": 388,
      "locked": false,
      "moveChildren": true,
      "tone": "neutral"
    }
  ]
}
