{
  "id": "serverless-app",
  "title": "Full-stack application",
  "description": "Run application logic with Functions and a distributed data layer.",
  "category": "Compute",
  "canvasWidth": 1120,
  "canvasHeight": 600,
  "theme": "dark",
  "grid": true,
  "numbered": false,
  "snap": true,
  "gridSize": 8,
  "notes": "Conceptual architecture. Configure authentication, caching rules, and origin access for your workload.",
  "updatedAt": "",
  "nodes": [
    {
      "id": "users",
      "label": "Browser",
      "subtitle": "Client",
      "icon": "pi-desktop",
      "x": 48,
      "y": 244,
      "width": 152,
      "height": 96,
      "tone": "neutral",
      "shape": "card",
      "locked": false
    },
    {
      "id": "app",
      "label": "Applications",
      "subtitle": "Request routing",
      "icon": "ai-edge-application",
      "x": 288,
      "y": 244,
      "width": 152,
      "height": 96,
      "tone": "azion",
      "shape": "card",
      "locked": false
    },
    {
      "id": "fn",
      "label": "Functions",
      "subtitle": "Application logic",
      "icon": "ai-edge-functions",
      "x": 528,
      "y": 244,
      "width": 152,
      "height": 96,
      "tone": "azion",
      "shape": "card",
      "locked": false
    },
    {
      "id": "sql",
      "label": "SQL Database",
      "subtitle": "Relational data",
      "icon": "ai-edge-sql",
      "x": 856,
      "y": 140,
      "width": 152,
      "height": 96,
      "tone": "azion",
      "shape": "card",
      "locked": false
    },
    {
      "id": "kv",
      "label": "KV Store",
      "subtitle": "Application state",
      "icon": "ai-edge-kv",
      "x": 856,
      "y": 348,
      "width": 152,
      "height": 96,
      "tone": "azion",
      "shape": "card",
      "locked": false
    }
  ],
  "edges": [
    {
      "id": "users-app",
      "from": "users",
      "to": "app",
      "label": "HTTPS",
      "dashed": false,
      "routing": "orthogonal",
      "arrow": "end",
      "locked": false
    },
    {
      "id": "app-fn",
      "from": "app",
      "to": "fn",
      "label": "Rules Engine",
      "dashed": false,
      "routing": "orthogonal",
      "arrow": "end",
      "locked": false
    },
    {
      "id": "fn-sql",
      "from": "fn",
      "to": "sql",
      "label": "Query",
      "dashed": false,
      "routing": "orthogonal",
      "arrow": "end",
      "locked": false
    },
    {
      "id": "fn-kv",
      "from": "fn",
      "to": "kv",
      "label": "Read / write",
      "dashed": false,
      "routing": "orthogonal",
      "arrow": "end",
      "locked": false
    }
  ],
  "groups": [
    {
      "id": "azion",
      "label": "AZION PLATFORM",
      "x": 248,
      "y": 104,
      "width": 816,
      "height": 388,
      "locked": false,
      "moveChildren": true,
      "tone": "neutral"
    }
  ]
}
